/*
 * org.riverock.portlet -- Portlet Library
 * 
 * Copyright (C) 2004, Riverock Software, All Rights Reserved.
 * 
 * Riverock -- The Open-source Java Development Community
 * http://www.riverock.org
 * 
 * 
 * This program is free software; you can redistribute it and/or
 * modify it under the terms of the GNU General Public
 * License as published by the Free Software Foundation; either
 * version 2 of the License, or (at your option) any later version.
 *
 * This library is distributed in the hope that it will be useful,
 * but WITHOUT ANY WARRANTY; without even the implied warranty of
 * MERCHANTABILITY or FITNESS FOR A PARTICULAR PURPOSE. See the GNU
 * General Public License for more details.
 *
 * You should have received a copy of the GNU General Public
 * License along with this library; if not, write to the Free Software
 * Foundation, Inc., 59 Temple Place, Suite 330, Boston, MA 02111-1307 USA
 *
 */

<?xml version="1.0" encoding="UTF-8"?>
<!-- edited with XMLSPY v5 rel. 4 U (http://www.xmlspy.com) by Serge (NewEdge) -->
<!--W3C Schema generated by XMLSPY v5 rel. 4 U (http://www.xmlspy.com)-->
<xs:schema xmlns:xs="http://www.w3.org/2001/XMLSchema" elementFormDefault="qualified">
	<xs:element name="Article">
		<xs:complexType>
			<xs:choice maxOccurs="unbounded">
				<xs:element ref="ArticlePara" minOccurs="0" maxOccurs="unbounded"/>
				<xs:element ref="Link" minOccurs="0" maxOccurs="unbounded"/>
				<xs:element ref="PreText" minOccurs="0" maxOccurs="unbounded"/>
			</xs:choice>
		</xs:complexType>
	</xs:element>
	<xs:element name="ArticlePara" type="xs:string"/>
	<xs:element name="Link">
		<xs:complexType>
			<xs:simpleContent>
				<xs:extension base="xs:string">
					<xs:attribute name="href" type="xs:anyURI" use="required"/>
				</xs:extension>
			</xs:simpleContent>
		</xs:complexType>
	</xs:element>
	<xs:element name="PreText" type="xs:string"/>
</xs:schema>
