<?xml version="1.0" encoding="UTF-8"?>
<!--
/*
 * org.riverock.portlet - Portlet Library
 * 
 * Copyright (C) 2004, Riverock Software, All Rights Reserved.
 * 
 * Riverock - The Open-source Java Development Community
 * http://www.riverock.org
 * 
 * 
 * This program is free software; you can redistribute it and/or
 * modify it under the terms of the GNU General Public
 * License as published by the Free Software Foundation; either
 * version 2 of the License, or (at your option) any later version.
 *
 * This library is distributed in the hope that it will be useful,
 * but WITHOUT ANY WARRANTY; without even the implied warranty of
 * MERCHANTABILITY or FITNESS FOR A PARTICULAR PURPOSE. See the GNU
 * General Public License for more details.
 *
 * You should have received a copy of the GNU General Public
 * License along with this library; if not, write to the Free Software
 * Foundation, Inc., 59 Temple Place, Suite 330, Boston, MA 02111-1307 USA
 *
 */
-->
<Article xmlns:xsi="http://www.w3.org/2001/XMLSchema-instance" xsi:noNamespaceSchemaLocation="C:\sandbox\js-portlet\doc\public\jsmithy-portlet-article-data.xsd">
	<ArticlePara>–ö–∞–∫ —Å–æ–∑–¥–∞—Ç—å –ø—Ä–æ—Å—Ç–µ–π—à–∏–π –ø–æ—Ä—Ç–ª–µ—Ç</ArticlePara>
	<ArticlePara>–î–∞–Ω–Ω–∞—è —Å—Ç–∞—Ç—å—è –æ–ø–∏—Å—ã–≤–∞–µ—Ç –∫–∞–∫ —Å–æ–∑–¥–∞—Ç—å –ø—Ä–æ—Å—Ç–µ–π—à–∏–π –ø–æ—Ä—Ç–ª–µ—Ç Hello. –î–ª—è —Å–æ–∑–¥–∞–Ω–∏—è –∏—Å–ø–æ–ª—å–∑—É–µ—Ç—Å—è –±–∞–∑–∞ Oracle</ArticlePara>
	<ArticlePara>–°–æ–∑–¥–∞–¥–∏–º —Ç–∞–±–ª–∏—Ü—É TEST_HELLO</ArticlePara>
	<PreText>create table MILLENNIUM.TEST_HELLO
    (ID_HELLO                      number,
    ID_SITE_SUPPORT_LANGUAGE       number,
    HELLO_TEXT                     varchar2(100),
    HELLO_CODE                     varchar2(50)  
    )
/
</PreText>
	<ArticlePara>–°–æ–∑–¥–∞–¥–∏–º sequence</ArticlePara>
	<PreText>CREATE SEQUENCE MILLENNIUM.SEQ_TEST_HELLO
 START WITH  1
 INCREMENT BY  1
 MINVALUE  1
 MAXVALUE  9999999999
 NOCACHE 
/</PreText>
	<ArticlePara>–ó–∞—Ä–µ–≥–µ—Å—Ç—Ä–∏—Ä—É–µ–º –Ω–æ–≤—ã–π –ø–æ—Ä—Ç–ª–µ—Ç. –î–ª—è —ç—Ç–æ–≥–æ —Å–æ–∑–¥–∞–¥–∏–º –Ω–æ–≤—ã–π —Ñ–∞–π–ª test_hello.xml –∏ –∑–∞–ø–∏—à–µ–º –µ–≥–æ –≤ –¥–∏—Ä–µ–∫—Ç–æ—Ä–∏–π WEB-INF/mill/portlet.</ArticlePara>
	<PreText>&lt;?xml version="1.0" encoding="utf-8"?&gt;
&lt;portlet-app version="webmill portlet 3.0" xmlns="http://java.sun.com/xml/ns/portlet/portlet-app_1_0.xsd" xmlns:xsi="http://www.w3.org/2001/XMLSchema-instance" xsi:schemaLocation="http://java.sun.com/xml/ns/portlet/portlet-app_1_0.xsd
\sandbox\js-portlet\src-schema\xsd\portlet.xsd"&gt;
	&lt;portlet&gt;
		&lt;portlet-name&gt;test.hello&lt;/portlet-name&gt;
		&lt;portlet-class&gt;TestHello&lt;/portlet-class&gt;
		&lt;init-param&gt;
			&lt;name&gt;type-portlet&lt;/name&gt;
			&lt;value&gt;view&lt;/value&gt;
		&lt;/init-param&gt;
		&lt;init-param&gt;
			&lt;name&gt;is-url&lt;/name&gt;
			&lt;value&gt;false&lt;/value&gt;
		&lt;/init-param&gt;
		&lt;init-param&gt;
			&lt;name&gt;name-portlet-id&lt;/name&gt;
			&lt;value&gt;test.id_hello&lt;/value&gt;
		&lt;/init-param&gt;
		&lt;init-param&gt;
			&lt;name&gt;name-portlet-code-string&lt;/name&gt;
			&lt;value&gt;test.hello_code&lt;/value&gt;
		&lt;/init-param&gt;
		&lt;init-param&gt;
			&lt;name&gt;is-get-instance&lt;/name&gt;
			&lt;value&gt;true&lt;/value&gt;
		&lt;/init-param&gt;
		&lt;init-param&gt;
			&lt;name&gt;class-name-get-list&lt;/name&gt;
			&lt;value&gt;TestHello&lt;/value&gt;
		&lt;/init-param&gt;
		&lt;supports&gt;
			&lt;mime-type&gt;text/html&lt;/mime-type&gt;
		&lt;/supports&gt;
		&lt;portlet-info&gt;
			&lt;title&gt;Test Hello portlet&lt;/title&gt;
		&lt;/portlet-info&gt;
	&lt;/portlet&gt;
&lt;/portlet-app&gt;
</PreText>
	<ArticlePara>–°–æ–∑–¥–∞–¥–∏–º –∫–ª–∞—Å—Å TestHello. –≠—Ç–æ—Ç –∫–ª–∞—Å—Å —Ä–µ–∞–ª–∏–∑—É–µ—Ç —Å–ª–µ–¥—É—â–∏–µ –∏–Ω—Ç–µ—Ä—Ñ–µ–π—Å—ã - Portlet, PortletResultObject, PortletGetList</ArticlePara>
	<ArticlePara>Portlet - –æ—Å–Ω–æ–≤–Ω–æ–π –∏–Ω—Ç–µ—Ä—Ñ–µ–π—Å —á–µ—Ä–µ–∑ –∫–æ—Ç–æ—Ä—ã–π ContextNavigator —É—Ç—Ä–∞–≤–ª—è–µ—Ç –ø–æ—Ä—Ç–ª–µ—Ç–∞–º–∏. –?—Å–ø–æ–ª—å–∑—É–µ—Ç—Å—è –Ω–∞ —ç—Ç–∞–ø–µ —Å–æ–∑–¥–∞–Ω–∏—è –ø–æ—Ä—Ç–ª–µ—Ç–∞</ArticlePara>
	<ArticlePara>PortletResultObject - –?—Å–ø–æ–ª—å–∑—É–µ—Ç—Å—è –Ω–∞ —ç—Ç–∞–ø–µ —Ä–µ–Ω–¥–µ—Ä–∏–Ω–≥–∞ –ø–æ—Ä—Ç–ª–µ—Ç–∞</ArticlePara>
	<ArticlePara>PortletGetList - –∏—Å–ø–æ–ª—å–∑—É–µ—Ç—Å—è –¥–ª—è —Å–æ–∑–¥–∞–Ω–∏—è –º–µ–Ω—é. –í–æ–∑–≤—Ä–∞—â–∞–µ—Ç —Å–ø–∏—Å–æ–∫ –¥–æ—Å—Ç—É–ø–Ω—ã—Ö –ø–æ—Ä—Ç–ª–µ—Ç–æ–≤</ArticlePara>
	<ArticlePara>–ó–∞—Ä–µ–≥–µ—Å—Ç—Ä–∏—Ä—É–µ–º –Ω–æ–≤—ã–π —Ç–∏–ø –ø–æ—Ä—Ç–ª–µ—Ç–∞</ArticlePara>
	<PreText>insert into SITE_CTX_TYPE
(ID_SITE_CTX_TYPE, TYPE)
select SEQ_SITE_CTX_TYPE.nextval, 'test.hello' from dual
/
</PreText>
	<ArticlePara>–°–æ–∑–¥–∞–¥–∏–º –æ–ø–∏—Å–∞—Ç–µ–ª—å –¥–ª—è –º–µ–º–±–µ—Ä —Ä–∞–∑–¥–µ–ª–∞. –° –ø–æ–º–æ—â—å—é –Ω–µ–≥–æ –º—ã —Å–º–æ–∂–µ—Ç –±—ã—Å—Ç—Ä–æ –∑–∞–Ω–µ—Å—Ç–∏ –Ω–æ–≤—ã–µ –∑–Ω–∞—á–µ–Ω–∏—è –¥–ª—è –Ω–∞—à–µ–≥–æ –ø–æ—Ä—Ç–ª–µ—Ç–∞. –ù–æ–≤—ã–π –æ–ø–∏—Å–∞—Ç–µ–ª—å –∑–∞–ø–∏—à–µ–º –≤ —Ñ–∞–π–ª test-hello.xml –≤ –¥–∏—Ä–µ–∫—Ç–æ—Ä–∏–π WEB-INF/mill/xml</ArticlePara>
	<Link href="/aaa">–ú–µ–º–±–µ—Ä –æ–ø–∏—Å–∞—Ç–µ–ª—å</Link>
	<ArticlePara>–ö–æ–¥ java –∫–ª–∞—Å—Å–∞:</ArticlePara>
	<PreText>/**
 * Author: mill
 * Date: Jan 10, 2003
 * Time: 9:41:20 AM
 *
 * $Id$
 */

import java.sql.PreparedStatement;
import java.sql.ResultSet;
import java.util.ArrayList;
import java.util.List;

import org.riverock.common.tools.RsetTools;
import org.riverock.common.tools.StringTools;
import org.riverock.generic.db.DatabaseAdapter;
import org.riverock.generic.db.DatabaseManager;
import org.riverock.generic.main.CacheFactory;
import org.riverock.portlet.member.ClassQueryItem;
import org.riverock.webmill.config.WebmillConfig;
import org.riverock.webmill.portlet.Portlet;
import org.riverock.webmill.portlet.PortletGetList;
import org.riverock.webmill.portlet.PortletParameter;
import org.riverock.webmill.portlet.PortletResultObject;

import org.apache.log4j.Logger;

public class TestHello implements Portlet, PortletResultObject, PortletGetList
{
    private static Logger log = Logger.getLogger( TestHello.class );

    private static CacheFactory cache = new CacheFactory( TestHello.class.getName() );

    public String hello = "";
    public Long id = null;
    public String helloCode = "";
    public PortletParameter param = null;
    public Long idSupportLanguage = null;

    protected void finalize() throws Throwable
    {
        helloCode = null;
        param = null;

        super.finalize();
    }

    public void setParameter(PortletParameter param_)
    {
        this.param = param_;
    }

    public PortletResultObject getInstance(DatabaseAdapter db__) throws Exception
    {
        return null;
    }

    public byte[] getXml(String name)
        throws Exception
    {
        if(log.isDebugEnabled())
            log.debug("TestHello. method is 'Xml'");

        return getXml();
    }

    public byte[] getXml()
        throws Exception
    {
        if(log.isDebugEnabled())
            log.debug("TestHEllo. method is 'Xml'");

        String xml = "&lt;?xml version=\"1.0\" encoding=\"utf-8\"?&gt;\n"+
                "&lt;TestHello&gt;&lt;Hello&gt;"+ hello + "&lt;/Hello&gt;&lt;/TestHello&gt;";

        if (log.isDebugEnabled())
            log.debug( "TestHEllo. getXml - "+xml );

        return xml.getBytes( WebmillConfig.getHtmlCharset() );
    }

    public boolean isXml(){ return true; }
    public boolean isHtml(){ return false; }

    public TestHello(){}

    public PortletResultObject getInstance(DatabaseAdapter db__, long id__)
            throws Exception
    {
        return getInstance(db__, new Long(id__) );
    }

    public PortletResultObject getInstance(DatabaseAdapter db__, Long id__)
            throws Exception
    {
        try
        {
            PortletResultObject portletObject = (PortletResultObject) cache.getInstanceNew(db__, id__);
            ((Portlet)portletObject).setParameter( this.param );
            return portletObject;
        }
        catch(Exception e)
        {
            log.error("Error get instance of TestHello", e);
            throw e;
        }
    }

    static String sql_ = null;
    static
    {
        sql_ =
            "select a.ID_HELLO " +
            "from   TESTHELLO a " +
            "where a.ID_SITE_SUPPORT_LANGUAGE=? and a.HELLO_CODE=?";

        try
        {
            org.riverock.sql.cache.SqlStatement.registerSql( sql_, new TestHello().getClass() );
        }
        catch(Exception e)
        {
            log.error("Exception in registerSql, sql\n"+sql_, e);
        }
        catch(Error e)
        {
            log.error("Error in registerSql, sql\n"+sql_, e);
        }
    }

    public PortletResultObject getInstanceByCode(DatabaseAdapter db__, String articleCode_)
            throws Exception
    {
        if (log.isDebugEnabled())
            log.debug("#10.01.01 " + articleCode_);

        Long idSupportLanguageCurrent = param.getJspPage().p.getIdSupportLanguage(param.getJspPage().currentLocale);

        PreparedStatement ps = null;
        ResultSet rs = null;
        try
        {
            ps = db__.prepareStatement(sql_);
            RsetTools.setLong(ps, 1, idSupportLanguageCurrent );
            ps.setString(2, articleCode_);

            rs = ps.executeQuery();
            if (rs.next())
            {
                if (log.isDebugEnabled())
                    log.debug("#10.01.04 " + RsetTools.getLong(rs, "ID_HELLO"));

                return getInstance(db__, RsetTools.getLong(rs, "ID_HELLO"));
            }

            if (log.isDebugEnabled())
                log.debug("#10.01.05 ");

            // return dummy Article
            return getInstance(db__, -1);
        }
        catch(Exception e)
        {
            log.error("Exception in TestHello.getInstanceByCode()", e);
            throw e;
        }
        catch(Error e)
        {
            log.error("Error in TestHello.getInstanceByCode()", e);
            throw e;
        }
        finally
        {
            DatabaseManager.close(rs, ps);
            rs = null;
            ps = null;